{
  "$schema": "https://json-schema.org/draft/2020-12/schema",
  "$id": "https://pengzhengyi.github.io/dialoguedown/schema/fixture-0.schema.json",
  "title": "DialogueDown conformance fixture",
  "description": "One case from the conformance corpus. A fixture states what a runtime must do with a playbook: either the verdict a reader must reach about the document, or the conversation a runner must be able to hold with it. Fixtures are hand-authored from the design rather than recorded from a run, so unknown properties are refused: a misspelled field here is a mistake to surface, not a newer writer talking to an older reader.",
  "type": "object",
  "required": [
    "name",
    "playbook",
    "because"
  ],
  "oneOf": [
    {
      "title": "A readable fixture",
      "description": "Asks whether a reader can load the document at all.",
      "required": [
        "verdict"
      ],
      "not": {
        "required": [
          "session"
        ]
      }
    },
    {
      "title": "A playable fixture",
      "description": "Asks whether a runner holds the same conversation.",
      "required": [
        "session"
      ],
      "not": {
        "required": [
          "verdict"
        ]
      }
    }
  ],
  "properties": {
    "$schema": {
      "type": "string",
      "description": "Where an editor can find this schema."
    },
    "name": {
      "type": "string",
      "description": "What this fixture asserts, as a sentence a failure can report."
    },
    "playbook": {
      "type": "string",
      "description": "The document this fixture is about, named relative to the fixture. Named rather than assumed, so a case may point at a document under any name."
    },
    "because": {
      "type": "string",
      "description": "Why the fixture claims what it claims, for a human reviewing the corpus. Required: a case nobody can weigh on sight is a case that silently rots."
    },
    "verdict": {
      "enum": [
        "accept",
        "refuse"
      ],
      "description": "What a reader must do with the document. A refusal's message is never asserted, so that every runtime may explain itself in its own language."
    },
    "session": {
      "$ref": "#/$defs/session"
    }
  },
  "additionalProperties": false,
  "$defs": {
    "session": {
      "type": "array",
      "minItems": 1,
      "description": "One conversation: what a driver sends, interleaved with what the runtime must reply, in the order it happens.",
      "items": {
        "$ref": "#/$defs/turn"
      }
    },
    "turn": {
      "oneOf": [
        {
          "type": "object",
          "required": [
            "send"
          ],
          "properties": {
            "send": {
              "$ref": "#/$defs/send"
            }
          },
          "additionalProperties": false
        },
        {
          "type": "object",
          "required": [
            "expect"
          ],
          "properties": {
            "expect": {
              "$ref": "#/$defs/expect"
            }
          },
          "additionalProperties": false
        }
      ]
    },
    "send": {
      "description": "One message from the driver, in the protocol's own vocabulary.",
      "oneOf": [
        {
          "enum": [
            "next",
            "done",
            "describe"
          ],
          "description": "Advance one step, report that the effect just asked for has been carried out, or ask where the run stands."
        },
        {
          "type": "object",
          "required": [
            "choose"
          ],
          "properties": {
            "choose": {
              "type": "integer",
              "minimum": 0,
              "description": "The zero-based position, among the options just offered, of the one taken. Every menu is offered in the order written, so this is also the option's position as written."
            }
          },
          "additionalProperties": false
        },
        {
          "type": "object",
          "required": [
            "supply"
          ],
          "properties": {
            "supply": {
              "type": "object",
              "description": "What the world says, by the key the runtime asked about."
            }
          },
          "additionalProperties": false
        },
        {
          "type": "object",
          "required": [
            "start"
          ],
          "properties": {
            "start": {
              "type": "string",
              "description": "The anchor to begin at, instead of the playbook's entry."
            }
          },
          "additionalProperties": false
        },
        {
          "type": "object",
          "required": [
            "failed"
          ],
          "properties": {
            "failed": {
              "type": "string",
              "minLength": 1,
              "description": "Why the host could not carry the effect out, in its own words. The run stands still, so the driver may answer `done` on a retry or give up."
            }
          },
          "additionalProperties": false
        }
      ]
    },
    "expect": {
      "description": "One message the runtime must produce next. No entry carries a node reference: a reference is a position, and an assertion that changed whenever the compiler renumbered would be a liability rather than a test.",
      "type": "object",
      "minProperties": 1,
      "maxProperties": 1,
      "properties": {
        "said": {
          "type": "object",
          "required": [
            "speech"
          ],
          "properties": {
            "speaker": {
              "type": "string",
              "description": "The speaker's name, never their index. Absent for the anonymous default speaker, who has no name."
            },
            "speech": {
              "$ref": "#/$defs/speech"
            }
          },
          "additionalProperties": false
        },
        "continued": {
          "type": "object",
          "description": "More of the line a said opened: the words after a command, sent only when they say something. It names no speaker, because whoever opened the line is still speaking.",
          "required": [
            "speech"
          ],
          "properties": {
            "speech": {
              "$ref": "#/$defs/speech"
            }
          },
          "additionalProperties": false
        },
        "offer": {
          "type": "object",
          "description": "The menu offered to the player. What was taken is not recorded here: the next send says so.",
          "required": [
            "ordered",
            "options"
          ],
          "properties": {
            "ordered": {
              "type": "boolean",
              "description": "Whether the writer numbered the options, so the host must show them in the order offered. A bulleted menu may be shown in any order, but every menu is offered in the order written."
            },
            "options": {
              "type": "array",
              "description": "Every option offered, in the order offered, which is the order written.",
              "items": {
                "type": "object",
                "required": [
                  "label",
                  "available"
                ],
                "properties": {
                  "label": {
                    "$ref": "#/$defs/speech"
                  },
                  "available": {
                    "type": "boolean",
                    "description": "Whether the option may be taken. A failing option is shown unavailable rather than hidden."
                  }
                },
                "additionalProperties": false
              }
            }
          },
          "additionalProperties": false
        },
        "perform": {
          "description": "The effect the runtime asks the host to carry out, as the playbook names it. The run does not go past it until the driver sends `done`, so an effect is settled in the world before anything reads it.",
          "oneOf": [
            {
              "type": "object",
              "required": [
                "kind",
                "action"
              ],
              "properties": {
                "kind": {
                  "const": "default-command"
                },
                "action": {
                  "type": "string",
                  "description": "The phrase the writer wrote."
                }
              },
              "additionalProperties": false
            },
            {
              "type": "object",
              "required": [
                "kind",
                "name"
              ],
              "properties": {
                "kind": {
                  "const": "custom-command"
                },
                "name": {
                  "type": "string",
                  "description": "The command's name, as the host binds it."
                },
                "args": {
                  "type": "array",
                  "items": {
                    "type": "string"
                  },
                  "description": "The arguments the writer supplied. May be empty."
                }
              },
              "additionalProperties": false
            }
          ]
        },
        "resolve": {
          "type": "array",
          "minItems": 1,
          "description": "The keys the runtime asked the world about.",
          "items": {
            "type": "string"
          }
        },
        "invalidated": {
          "description": "An offered option that stopped being available. Left loose until the runtime settles the shape."
        },
        "ended": {
          "type": "object",
          "description": "The run finished.",
          "additionalProperties": false
        },
        "refused": {
          "type": "object",
          "description": "The command could not be taken. The reason is from the protocol's closed set, so a fixture asserts why a run refused without asserting how a refusal is worded.",
          "required": [
            "reason"
          ],
          "properties": {
            "reason": {
              "type": "string",
              "enum": [
                "not-started",
                "already-ended",
                "misplaced",
                "unknown-command",
                "leads-nowhere",
                "endless-loop",
                "unanswered-key",
                "unasked-key",
                "wrong-answer-kind",
                "key-needed-both-ways",
                "unplayable-node",
                "no-such-option",
                "unavailable-option",
                "invalid-draw"
              ]
            }
          },
          "additionalProperties": false
        },
        "at": {
          "description": "Where the run stands, in reply to describe. Left loose until the runtime settles the shape."
        },
        "out": {
          "description": "What leads onward from there, in reply to describe. Left loose until the runtime settles the shape."
        }
      },
      "additionalProperties": false
    },
    "speech": {
      "description": "What was said, or an option's label. An array asserts the playbook's own fragments, exactly as it serializes them; a plain string asserts the flattening of those fragments -- a deliberately weaker claim, chosen so a fixture that is not about styling stays readable. See playbook-0.schema.json for what a fragment is.",
      "oneOf": [
        {
          "type": "string",
          "description": "Every fragment's plain text, concatenated, with style markers dropped and resolved queries substituted."
        },
        {
          "type": "array",
          "minItems": 1,
          "items": {
            "type": "object",
            "required": [
              "kind"
            ],
            "properties": {
              "kind": {
                "type": "string"
              }
            }
          }
        }
      ]
    }
  }
}
