{
  "$schema": "https://pengzhengyi.github.io/dialoguedown/schema/fixture-0.schema.json",
  "name": "a jump transfers without returning",
  "playbook": "playbook.json",
  "because": "the line after the jump is unreachable, so hearing it would prove the runner treated a divert as a detour",
  "session": [
    {
      "expect": {
        "said": {
          "speaker": "Alice",
          "speech": "Away."
        }
      }
    },
    {
      "send": "next"
    },
    {
      "expect": {
        "said": {
          "speaker": "Alice",
          "speech": "Here."
        }
      }
    },
    {
      "send": "next"
    },
    {
      "expect": {
        "ended": {}
      }
    }
  ]
}
