{
  "$schema": "https://pengzhengyi.github.io/dialoguedown/schema/fixture-0.schema.json",
  "name": "a command after the end is refused",
  "playbook": "playbook.json",
  "because": "an ended run accepts nothing further, and the driver has to be told so rather than left to guess -- a port that ignored the command, or began again from the top, would be caught here",
  "session": [
    {
      "expect": {
        "said": {
          "speaker": "Alice",
          "speech": "Hello."
        }
      }
    },
    {
      "send": "next"
    },
    {
      "expect": {
        "ended": {}
      }
    },
    {
      "send": "next"
    },
    {
      "expect": {
        "refused": {
          "reason": "already-ended"
        }
      }
    }
  ]
}
