{
  "$schema": "https://pengzhengyi.github.io/dialoguedown/schema/fixture-0.schema.json",
  "name": "an effect is performed before the run goes past it",
  "playbook": "playbook.json",
  "because": "the run must not reach the next line until the host says the effect is done -- a runtime that fired and forgot would let a guard after an effect read the world as it was before",
  "session": [
    {
      "expect": {
        "perform": {
          "kind": "default-command",
          "action": "fade in"
        }
      }
    },
    {
      "send": "done"
    },
    {
      "expect": {
        "said": {
          "speaker": "Alice",
          "speech": "Hello."
        }
      }
    },
    {
      "send": "next"
    },
    {
      "expect": {
        "ended": {}
      }
    }
  ]
}
