{
  "$schema": "https://pengzhengyi.github.io/dialoguedown/schema/fixture-0.schema.json",
  "name": "a random choice whose key weights the world answers with 0, with no fall-through, is refused as leading nowhere",
  "playbook": "playbook.json",
  "because": "no random option is guarded, so the compiler writes no fall-through; with both key weights answered 0 nothing is drawable and the run has nowhere to go, which is the error the language makes of a zero total at runtime, named by the refusal rather than by asking for a draw that could pick nothing",
  "session": [
    { "expect": { "resolve": ["Guard.Mood", "Guard.Temper"] } },
    { "send": { "supply": { "Guard.Mood": 0, "Guard.Temper": 0 } } },
    { "expect": { "refused": { "reason": "leads-nowhere" } } }
  ]
}
